Title,Abstract,related,prevent,monitor,analyze
Acetone Atmospheric Distribution Retrieved From Space,"As one of the most abundant oxygenated volatile organic compounds in the atmosphere, acetone (CH3C[O]CH3) influences atmospheric oxidants levels and ozone formation. Here we report the first unambiguous identification of acetone from the nadir-viewing satellite sounder Infrared Atmospheric Sounding Interferometer (IASI). Via a neural network-based retrieval approach that was previously applied to the retrieval of other weak absorbers, we obtain daily global acetone retrievals. A first intercomparison with independent measurements is conducted. As the retrieval method is computationally fast, it allowed the full reprocessing of the 2007–2018 IASI time series. Analysis of the retrieved global product and its seasonality suggests that emissions of acetone and precursors from the terrestrial biosphere at Northern Hemisphere middle and high latitudes are the main contributors to the atmospheric acetone abundance, more than year-round oxidation of anthropogenic isoalkanes. Remarkably, biomass burning does not appear to be a strong global source of acetone. ©2019. American Geophysical Union. All Rights Reserved.",,,,
"Oak Savannas in Western New York State, Circa 1795: Synthesizing Predictive Spatial Models and Historical Accounts to Understand Environmental and Native American Influences","This study models and maps oak savanna distribution ca. 1795 and determines how environmental conditions and Native American land use (NALU) shaped its distribution. Historical research has analyzed early landscape accounts to assess how Native Americans modified forests throughout the eastern United States. Predictive spatial modeling has sought to quantify anthropogenic and environmental drivers of forest conditions and to predict locations where NALU changed forest composition. Yet, studies have not rigorously synthesized these two methods. This research focused on oak savannas in western New York State (27,617 km2). We trained models of oak savanna distribution from historic vegetation data in relation to environmental predictors and NALU proxies. We then mapped historical accounts of oak savannas and NALU at European-American arrival and compared them to model predictions. Results suggest that 2 to 17 percent (depending on modeling technique) of the study area contained oak savanna, with a favored estimate of 3 to 6 percent. Synthesis of models and accounts suggests that oak savannas were attributable to NALU and dry environmental conditions but that NALU (specifically burning) was present at most oak savanna locations. Models of oak savanna distribution that considered proximity to Native American settlement had higher predictive performance and better predicted locations of historical oak savanna accounts, including those with descriptions of Native American burning. This study suggests that former oak savannas in the study area can be largely attributed to NALU. Furthermore, this study’s methodology and results contribute to a larger body of geographical literature on savanna landscapes. Key Words: anthropogenic burning, forests, modeling, Native Americans, oak savanna. © 2019, © 2019 by American Association of Geographers.",,,,
Production of Secondary Organic Aerosol During Aging of Biomass Burning Smoke From Fresh Fuels and Its Relationship to VOC Precursors,"After smoke from burning biomass is emitted into the atmosphere, chemical and physical processes change the composition and amount of organic aerosol present in the aged, diluted plume. During the fourth Fire Lab at Missoula Experiment, we performed smog-chamber experiments to investigate formation of secondary organic aerosol (SOA) and multiphase oxidation of primary organic aerosol (POA). We simulated atmospheric aging of diluted smoke from a variety of biomass fuels while measuring particle composition using high-resolution aerosol mass spectrometry. We quantified SOA formation using a tracer ion for low-volatility POA as a reference standard (akin to a naturally occurring internal standard). These smoke aging experiments revealed variable organic aerosol (OA) enhancements, even for smoke from similar fuels and aging mechanisms. This variable OA enhancement correlated well with measured differences in the amounts of emitted volatile organic compounds (VOCs) that could subsequently be oxidized to form SOA. For some aging experiments, we were able to predict the SOA production to within a factor of 2 using a fuel-specific VOC emission inventory that was scaled by burn-specific toluene measurements. For fires of coniferous fuels that were dominated by needle burning, volatile biogenic compounds were the dominant precursor class. For wiregrass fires, furans were the dominant SOA precursors. We used a POA tracer ion to calculate the amount of mass lost due to gas-phase oxidation and subsequent volatilization of semivolatile POA. Less than 5% of the POA mass was lost via multiphase oxidation-driven evaporation during up to 2 hr of equivalent atmospheric oxidation. ©2019. American Geophysical Union. All Rights Reserved.",,,,
Positive matrix factorization of organic aerosol: Insights from a chemical transport model,"Factor analysis of aerosol mass spectrometer measurements (organic aerosol mass spectra) is often used to determine the sources of organic aerosol (OA). In this study we aim to gain insights regarding the ability of positive matrix factorization (PMF) to identify and quantify the OA sources accurately. We performed PMF and multilinear engine (ME-2) analysis on the predictions of a state-of-the-art chemical transport model (PMCAMx-SR, Particulate Matter Comprehensive Air Quality Model with extensions - source resolved) during a photochemically active period for specific sites in Europe in an effort to interpret the diverse factors usually identified by PMF analysis of field measurements. Our analysis used the predicted concentrations of 27 OA components, assuming that each of them is ""chemically different"" from the others. The PMF results based on the chemical transport model predictions are quite consistent (same number of factors and source types) with those of the analysis of AMS measurements. The estimated uncertainty of the contribution of fresh biomass burning is less than 30% and of the other primary sources less than 40 %, when these sources contribute more than 20% to the total OA. The PMF uncertainty increases for smaller source contributions, reaching a factor of 2 or even 3 for sources which contribute less than 10% to the OA. One of the major questions in PMF analysis of AMS measurements concerns the sources of the two or more oxygenated OA (OOA) factors often reported in field studies. Our analysis suggests that these factors include secondary OA compounds from a variety of anthropogenic and biogenic sources and do not correspond to specific sources. Their characterization in the literature as low-and high-volatility factors is probably misleading, because they have overlapping volatility distributions. However, the average volatility of the one often characterized as a low-volatility factor is indeed lower than that of the other (high-volatility factor). Based on the analysis of the PMCAMx-SR predictions, the first oxygenated OA factor includes mainly highly aged OA transported from outside Europe, but also highly aged secondary OA from precursors emitted in Europe. The second oxygenated OA factor contains fresher secondary organic aerosol from volatile, semivolatile, and intermediate volatility anthropogenic and biogenic organic compounds. The exact contribution of these OA components to each OA factor depends on the site and the prevailing meteorology during the analysis period. © Author(s) 2019.",,,,
Quantification of carbonaceous aerosol emissions from cookstoves in Senegal,"In some regions of the world, cooking with solid biomass fuels in open fires constitutes the largest source of elemental and organic carbon emissions. However, cooking-related carbonaceous aerosols are still poorly characterized. This paper presents an innovative characterization of elemental and organic carbon (EC and OC) emissions from cookstoves in West Africa. Four stove types (three-stone fire, rocket stove, basic ceramic stove, and gasifier) using two wood species (dimb and filao) were analyzed on a laboratory scale. The EC and OC emission factors based on fuel energy (EFs) when burning dimb were higher for all stoves, highlighting the need to account for the fuel type when reporting cookstove EFs. The highest EC EF was found for the rocket stove (0.18 ± 0.06 g MJ–1 and 0.06 ± 0.01 g MJ–1 for dimb and filao, respectively). The other tested stoves exhibited the same EC EF when burning dimb (0.09 ± 0.02 g MJ–1) and EC EFs ranging between 0.04 ± 0.01 and 0.05 ± 0.01 g MJ–1 when burning filao. The OC EF was highest, on average, for the gasifier (0.08 ± 0.01 g MJ–1), followed by those for the three-stone fire (0.18 ± 0.03 g MJ–1) and the basic ceramic stove (0.21 ± 0.08 g MJ–1). However, the results from testing the rocket stove and the three-stone fire under real cooking conditions using dimb wood indicate that the laboratory-scale tests overestimate the actual EC EFs. Also, the rocket stove did not show a reduction in wood use compared to the three-stone fire, suggesting that the carbonaceous aerosol emissions from the former produce more warming than those from the latter. Therefore, the total EC and OC stove emissions, in addition to the EFs, must be reported. As the impacts of carbonaceous aerosol highly depend on the location of emission, this study contributes valuable data to emission inventories and climate prediction models at national and regional levels. © Taiwan Association for Aerosol Research.",,,,
Snow Albedo Reduction in Central Andes by Atmospheric Aerosols: Case Study on the Tunuyán Basin (Argentina),"Changes in snow albedo (SA) on several basins of the central Andes of Argentina are associated with the possible deposition of light-absorbing particles (LAP) in the austral spring. To demonstrate this possibility, we correlate SA with daily data of snow cover (SC), aerosol optical depth (AOD) and land surface temperature (LST) available from the Moderate-Resolution Imaging Spectroradiometer (MODIS) on board NASA Terra satellite during 2000-2016, and other derived parameters such as days after albedo (DAS) and snow precipitation (SP) from the Tropical Rainfall Measuring Mission (TRMM). We used satellite pixels with 100% snow cover to obtain monthly average value of SA, LST, AOD, DAS and SP performing multiple regression analysis. Further, we analysed biomass burning emissions in northem Argentina using MODIS products MCD64 collection C6 as possible source for snow pollution. Aerosol deposition and trajectories were analysed using WRF-Chem atmospheric numerical prediction model, with inventories of regional anthropogenic emissions of own elaboration (lat. 0.025°x long. 0.025°) and the estimation of open burning emissions from the FINN global inventory (Fire INventory from NCAR).  © 2020 IEEE.",,,,
Fermentative production of soluble phosphorus fertilizer using paddy straw: an alternate to biomass burning,"To mitigate environmental impacts caused by illegal burning of paddy straw or stubble in the open fields, an alternate and economical technology for microbial degradation of lignocellulosic biomass and production of soluble phosphorus fertilizer was explored. Low-grade Mussoorie rock phosphate and Udaipur rock phosphate supplemented paddy straw was exploited as solid-state fermentation medium for the fungal-mediated release of soluble phosphorus by phosphate dissolving and cellulase producing strains of Aspergillus niger (ITCC 6719) and Aspergillus awamori (F18). Optimization of process parameters revealed that elemental composition of rock phosphate and its dose are important to affect the per cent yield of soluble phosphorus. Addition of ammonium sulphate or ammonium nitrate or urea to rock phosphate supplemented paddy straw inhibited the release of soluble phosphorus. Contrarily, adding 10% wheat bran (w/w) into paddy straw-rock phosphate mixture and its subsequent fungal inoculation at 10% (v/w) resulted in maximum solubilization (37–38%) of rock phosphate on 21st day of incubation. The fermented extract of this mixture also recorded the highest cellulase activity titre (76.32 IU ml−1) after 3 weeks of fermentation. Soil–plant interaction studies with wheat crop revealed that application of this fermented mixture to soil not only improved the plant biomass but also increased the soil available phosphorus content by ~ twofold, compared to treatments receiving recommended chemical phosphorus. Bio-processing of rock phosphate using wheat bran-amended paddy straw as fermentation substrate can provide an economical and alternate soluble fertilizer for enhanced crop phosphorus nutrition. © 2018, Islamic Azad University (IAU).",,,,
Comparison of modeled and measured ice nucleating particle composition in a cirrus cloud,"The contribution of heterogeneous ice nucleation to the formation of cirrus cloud ice crystals is still not well quantified. This results in large uncertainties when predicting cirrus radiative effects and their role in Earth's climate system. The goal of this case study is to simulate the composition, and thus activation conditions, of ice nucleating particles (INPs) to evaluate their contribution to heterogeneous cirrus ice formation in relation to homogeneous ice nucleation. For this, the regional model COSMO-Aerosols and Reactive Trace Gases (COSMO-ART) was used to simulate a synoptic cirrus cloud over Texas on 13 April 2011. The simulated INP composition was then compared to measured ice residual particle (IRP) composition from the actual event obtained during the NASA Midlatitude Airborne Cirrus Properties Experiment (MACPEX) aircraft campaign. These IRP measurements indicated that the dominance of heterogeneous ice nucleation was mainly driven by mineral dust with contributions from a variety of other particle types. Applying realistic activation thresholds and concentrations of airborne transported mineral dust and biomass-burning particles, the model implementing the heterogeneous ice nucleation parameterization scheme of Ullrich et al. is able to reproduce the overall dominating ice formation mechanism in contrast to the model simulation with the scheme of Phillips et al. However, the model showed flaws in reproducing the IRP composition. © 2019 American Meteorological Society.",,,,
Influence of herbaceous biomass ash pre-treated by alkali metal leaching on the agglomeration/sintering and corrosion behaviors,"Partially melted ash particles cause increased ash fouling, agglomeration and sintering behaviors during biomass combustion. In addition, ash fouling facilitates the corrosion behavior of stainless steel. In this work, the agglomeration/sintering and corrosion behaviors of untreated herbaceous biomass ash and that pre-treated by an alkali metal leaching reaction were investigated under combustion conditions. Although the ash agglomeration tendency increased with increasing temperature, the tendency was reduced by alkali metal leaching pre-treatment. During comparison of sintering behavior, the degree of sintering (x/r) increased as a function of time but was substantially alleviated by alkali metal leaching pre-treatment. In comparison to the typical Frenkel sintering model, a modified Frenkel sintering model was shown to fit well with the experimental sintering behavior. Alkali metal leaching pre-treatment inhibited ash particle adhesion and made high melting temperature minerals, which was verified by scanning electron microscopy with energy dispersive X-ray spectroscopy (SEM-EDX), X-ray diffraction (XRD) analysis, the use of ternary mineral phase diagrams and adoption of a new chemical classification system. Furthermore, from SEM-EDX, alkali metal leaching pre-treatment was seen to reduce the corrosion by ash fouling on stainless steel (SUS) 316. Resultingly, the alkali metal leaching pre-treatment significantly alleviated the ash adhesion and corrosion behaviors. © 2019 Elsevier Ltd",,,,
"                         Assessment of air pollution origin based on year-long parallel measurement of PM                         2.5                          and PM                         10                          at two suburban sites in Prague, Czech Republic                     ","                             From 2nd April 2008 to 28th March 2009, a total 248 daily samples of the PM                             2.5                              and PM                             10                              were collected every sixth day parallel at two suburban sites (Libuš and Suchdol) located at the two opposite sides (south and north, respectively) of Prague, Czech Republic. The PM                             2.5                              samples were analyzed for ions by ion chromatography (IC), organic and elemental carbon (OC and EC) by OC/EC analyzer and PM                             10                              samples also for 56 elements by inductively coupled plasma-mass spectrometry (ICP-MS). The average annual PM                             2.5                              and PM                             10                              was 24.4 ± 13.0 μg m                             −3                              and 26.7 ± 15.1 μg m                             −3                             , respectively, in Prague-Libuš and 25.1 ± 22.1 μg m                             −3                              and 27.1 ± 23.2 μg m                             −3                             , respectively, in Prague-Suchdol. Since the species forming large part of the aerosol mass were strongly correlated (Spearman's rank correlation coefficient r                             s                              > 0.80), the variability of PM                             2.5                              and PM                             10                              concentration was mainly driven by the local meteorology or regional and/or long range transport. PM                             10                              mass closure was calculated based on analytical results with the average percentage of recalculated mass of 77 ± 19% in Prague-Libuš and 86 ± 16% in Prague-Suchdol. The most abundant groups in PM                             10                              at both sites during the four seasons were OM (Prague-Libuš 34% and Prague-Suchdol 37%) and SIA (Prague-Libuš 30% and Prague-Suchdol 34%). The Positive Matrix Factorization (PMF) was applied to the chemical composition of PM                             10                              from both sites (124 samples) together to determine its sources. The nine factors were assigned as: mixed factor secondary sulphate and biomass burning, secondary sulphate, traffic, secondary nitrate, road dust, residential heating, aged sea salt, industry and mixed factor road salt along with aged sea salt. According to the polar plots and ventilation index (VI) east/west classification analysis the sources were separated based on origin to four categories local, urban agglomeration, regional and long range transport (LRT). The mixed source secondary sulphate and biomass burning, residential heating and industry were common sources of local origin at both sites. Prague-Suchdol was influenced by traffic related pollution from the urban agglomeration more than Prague-Libuš where the traffic and road dust/salt were of local origin. The regional pollution by secondary sulphates and nitrate was also relevant at both sites along with long range transport of sea salt from North Atlantic Ocean, Norwegian Sea and North Sea. The contribution of the local sources to PM                             10                              was significant mainly at Prague-Libuš site. However, the sources of regional origin were also important and influence of urban agglomeration pollution to PM                             10                              is not negligible as well.                          © 2019 Elsevier B.V.",,,,
Organic tracers from biomass burning in snow from the coast to the ice sheet summit of East Antarctica,"Biomass burning is a significant process in the Earth system, driving ecosystem dynamics and changes in global vegetation, and affecting the carbon cycle and climate. Projections of future fire activities require an understanding of the connection between fire history and climate in the past. Polar snow/ice contain long-term records of past climates and fire activity and hold great promise to improve our understanding of wildfire patterns. Here, using ultra-high-performance liquid chromatography-tandem mass spectrometry techniques, we quantified three organic compounds (levoglucosan, vanillic, and syringic acids) released by biomass burning in snow samples collected along a 1250-km transect from the coast to the ice sheet summit Dome A in East Antarctica. Results indicate that these tracers are ubiquitous and have reached the ice sheet summit from the continental emissions in the Southern Hemisphere. These compounds showed high levels close to the coastal areas and decreased to a low level on the Antarctic plateau. The snow samples had similar levoglucosan/vanillic acid (∼45) and levoglucosan/syringic acid ratios (∼243) as aerosols from biomass burning. Multivariate analysis indicates that these compounds were likely derived from the burning of grasses and evergreen broadleaf trees that are widespread in Southern Hemisphere than from evergreen conifers that dominate northern hemisphere fire-prone ecosystems. Snow accumulation rate influenced the levels of these compounds, while coexisting ions had little effect on compound contents in the snow. The low concentrations of levoglucosan at inland sites (mean of 2.7 pg mL−1; versus 3.5 and 3.7 pg mL−1 in coastal and transition zones, respectively) could be associated with the oxidation by OH radicals under sunlight. Our analysis demonstrated that the ubiquity of multiple biomarkers from biomass burning in East Antarctic surface snow can provide baseline concentrations for future studies in Antarctica. © 2019 Elsevier Ltd",,,,
"Mineralogical, chemical and leaching characteristics of ashes from residential biomass combustion","Four types of pellets and three agro-fuels were chemically characterised and burned in a pellet stove. To assess the influence of the material composing the firebox and the combustion efficiency of distinct biomass heating devices in the composition of the bottom ashes, three of the pellets were also burned in a conventional woodstove and in a fireplace. Ashes were analysed for their C, H and N contents by an elemental analyser, whilst major and trace elements were quantified by inductively coupled plasma atomic-emission spectrometry and inductively coupled plasma mass spectrometry, respectively. The mineralogy of ashes was determined by X-ray powder diffraction. The European standard test was applied to samples to determine the leaching potential of major, minor and trace elements. The contents of major and trace elements in the different types of biomass presented enormous variations, which are reflected in dissimilar mineralogical and chemical compositions of the respective ashes. The leachable potential of several elements of environmental concern present in oxy-anionic form at the alkaline pH of biomass ashes were generally high in all samples. Concentrations of some elements in the leachates were in the range of values with classification of “hazardous materials” by the European legislation in what respects the acceptance of these wastes at landfills. Pellets made up of wood wastes and containing preservatives (chromated copper arsenate and ammoniacal copper arsenate) are of concern. Due to lower combustion efficiencies, the leachable potential for most of the trace elements in ashes from the woodstove, and especially from the fireplace, was lower than that of the pellet stove. © 2019, Springer-Verlag GmbH Germany, part of Springer Nature.",,,,
Haze effects on satellite remote sensing imagery and their corrections,"Imagery recorded using satellite sensors operating at visible wavelengths can be contaminated by atmospheric haze that originates from large scale biomass burning. Such issue can reduce the reliability of the imagery and therefore having an effective method for removing such contamination is crucial. The principal aim of this study is to investigate the effects of haze on remote sensing imagery and develop a method for removing them. In order to get a better understanding on the behaviour of haze, the effects of haze on satellite imagery were initially studied. A methodology of removing haze based on haze subtraction and filtering was then developed. The developed haze removal method was then evaluated by means of signal-to-noise ratio (SNR) and classification accuracy. The results show that the haze removal method is able to improve the haze-affected imagery qualitatively and quantitatively. © 2019 International Journal of Advanced Computer Science and Applications.",,,,
