Title,Abstract,related,prevent,monitor,analyze
Synthesis and characterization of biochar from dehradun rice straw and its application for adsorption of methylene blue dye,"Stubble management and burning is one of the major concerns in India, which creates environmental pollution and decreases in the air quality index in many Indian cities. Conversion of stubble into biochar is an eco-friendly way to manage stubble burning. In the current study, Dehradun rice straw has been used to synthesize biochar by the method of pyrolysis and acid activation. The biochar synthesized was characterized by the aid of SEM and EDAX techniques. The synthesized biochar after activation exhibited significant porosity and surface area. The results of methylene blue adsorption with the aid of rice straw biochar showed significant adsorption capacity at a concentration of 2mg/mL biochar at room temperature.  © 2023 Author(s).",,,,
"Fire in highland grasslands in the Atlantic Forest Biome, a burned areas time series analysis and its correlation with the legislation","Fire has been an intrinsic ecological component of the ecosystems, affecting the public, economic, and socio-cultural policies of human-nature interactions. Using fire over grassland vegetation is a traditional practice for livestock in the highland grasslands and has economic and environmental consequences that have not yet been understood. A better description of the spatio-temporal biomass burning patterns is needed to analyze the effects of creation and application in these areas. This study used remote sensing techniques based on Sentinel-2 data and machine learning algorithms to identify burning scars and compare them with a national fire collection database for the highland grasslands in the Atlantic Forest Biome in Brazil. The aim is to evaluate public management tools and legislation evolution during the 35 years of the time series analyzed. The results indicated that 12,285 ha of grasslands were converted to other uses, losing about 24% of their original formation, with 10% occurring after banned this practice in 2008. The burned areas classification using the Random Forest algorithm obtained an AUC = 0.9983. Divergences in the burned area’s extent and frequency were found between the municipality’s authorized license and those classified as burned. On average, only 43% of the burned area in the Parque Estadual do Tainhas and its buffer zone had an environmental permit in the last 5 years. This research’s results provide subsidies for revising and creating public policies and consequently help territorial management. Copyright © 2023 Herrmann, Nascimento, Freitas and Ometto.",,,,
Unexpected electrophiles in the atmosphere - anhydride nucleophile reactions and uptake to biomass burning emissions,"Biomass burning is a significant contributor to atmospheric pollution, its emissions have been found to have adverse impacts on climate and human health. Largely, these impacts are dictated by how the composition of the emissions changes once emitted into the atmosphere. Recently, anhydrides have been identified as a significant fraction of biomass burning emissions, however, little is known about their atmospheric evolution, or their interactions within the burn plume. Without this understanding, it is challenging to predict the impact of anhydrides on biomass burning emissions, and by extension, their influence on climate and health. In this study, we investigate anhydrides as potentially unrecognized electrophiles in the atmosphere. Firstly, by exploring their reactivity towards important biomass burning emitted nucleophiles, and secondly, by measuring their uptake on the emissions themselves. Our results show that phthalic and maleic anhydride can react with a wide range of nucleophiles, including hydroxy and amino-containing compounds, such as levoglucosan or aniline. Additionally, using a coated-wall flow tube setup, we demonstrate that anhydrides reactively uptake to biomass burning films and influence their composition. The anhydride nucleophile reaction was found to be irreversible, proceeding without sunlight or free radicals and indicating it may occur during the day or nighttime. Furthermore, the reaction products were found to be water-stable and contain functional groups which enhance their mass and likely contribute to the formation of secondary organic aerosol, with knock-on climate effects. Overall, our study sheds light on the fundamental chemistry of anhydrides and their potential impacts in the atmosphere. © 2023 The Royal Society of Chemistry.",,,,
Offline analysis of secondary formation markers in ambient organic aerosols by liquid chromatography coupled with time-of-flight mass spectrometry,"The present study provides a comprehensive assessment of the quantitative analysis by high-performance liquid chromatography coupled with dual orthogonal electrospray ionization time-of-flight mass spectrometry (HPLC-ESI-TOF-MS) of pinene markers, biomass-burning related phenols, and other relevant carboxylic acids in atmospheric aerosol samples. Significant insights into the quantitative determination are offered on the basis of systematic experiments targeting the optimization of chromatographic separation, ionization source, and mass spectrometer performance. After testing three analytical columns, the best separation of the compounds of interest was achieved on a Poroshell 120 EC[sbnd]C18 column (4.6 × 50 mm, 2.7 µm) thermostated at 35 °C, operating in gradient elution mode with 0.1% acetic acid in water and acetonitrile at a 0.8 mL min−1 flow rate. Optimal operational conditions for the ESI-TOF-MS instrument were identified as a 350 °C drying gas temperature, 13 L min−1 drying gas flow rate, 60 psig nebulizer pressure, 3000 V for the ion transfer capillary, 60 V for the skimmer, and 150 V for the fragmentor. Additionally, the matrix effect on the ESI efficiency and the spike recovery factors of the compounds were tested. Method quantification limits can go as low as in the 0.88–48.0 μg L − 1 (3.67–200 pg m − 3, at 120 m3 of sampled air) range. The developed method was shown to be reliable for the quantification of the targeted compounds in real atmospheric aerosol samples. The accuracy in the molecular mass determination of less than 5 ppm and the acquisition in the full scan mode were shown to bring additional insights into the organic constituents in atmospheric aerosols. © 2023",,,,
"Source apportionment of fine particulate matter at a megacity in China, using an improved regularization supervised PMF model","The source apportionment of particulate matter plays an important role in solving the atmospheric particulate pollution. Positive matrix factorization (PMF) is a widely used source apportionment model. At present, high resolution online datasets are increasingly rich, but acquiring accurate and timely source apportionment results is still challenging. Integrating prior knowledge into modelling process is an effective solution and can yield reliable results. This study proposed an improved source apportionment method for the regularization supervised PMF model (RSPMF). This method leveraged actual source profile to guide factor profile for rapidly and automatically identifying source categories and quantifying source contributions. The results showed that the factor profile from RSPMF could be interpreted as seven factors and approach to actual source profile. Average source contributions were also an agreement between RSPMF and EPAPMF, including secondary nitrate (26 %, 27 %), secondary sulfate (23 %, 24 %), coal combustion (18 %, 18 %), vehicle exhaust (15 %, 15 %), biomass burning (10 %, 9 %), dust (5 %, 4 %), industrial emission (3 %, 3 %). The solutions of RSPMF also exhibited good generalizability during different episodes. This study reveals the superiority of supervised model, this model embeds prior knowledge into modelling process to guide model for obtaining more reliable results. © 2023 Elsevier B.V.",,,,
Aqueous-phase chemistry of atmospheric phenolic compounds: A critical review of laboratory studies,"Phenolic compounds (PhCs) are crucial atmospheric pollutants typically emitted by biomass burning and receive particular concerns considering their toxicity, light-absorbing properties, and involvement in secondary organic aerosol (SOA) formation. A comprehensive understanding of the transformation mechanisms on chemical reactions in atmospheric waters (i.e., cloud/fog droplets and aerosol liquid water) is essential to predict more precisely the atmospheric fate and environmental impacts of PhCs. Laboratory studies play a core role in providing the fundamental knowledge of aqueous-phase chemical transformations in the atmosphere. This article critically reviews recent laboratory advances in SOA formation from the aqueous-phase reactions of PhCs. It focuses primarily on the aqueous oxidation of PhCs driven by two atmospheric reactive species: OH radicals and triplet excited state organics, including the important chemical kinetics and mechanisms. The effects of inorganic components (i.e., nitrate and nitrite) and transition metal ions (i.e., soluble iron) are highlighted on the aqueous-phase transformation of PhCs and on the properties and formation mechanisms of SOA. The review is concluded with the current knowledge gaps and future perspectives for a better understanding of the atmospheric transformation and SOA formation potential of PhCs. © 2022 Elsevier B.V.",,,,
"Atmospheric humic-like substances (HULIS) in Chongqing, Southwest China: Abundance, light absorption properties, and potential sources","Atmospheric humic-like substances (HULIS) have a great impact on radiative forcing and atmospheric oxidative capacity due to their efficient light absorption properties. Knowledge on atmospheric HULIS abundance and light absorption properties in southwest China is still very limited. In this study, a total of 81 daily samples of fine particulate matter (PM2.5) were collected at two sites in Chongqing during four one-month periods in 2015, each of which representing a typical season. Mass concentrations of HULIS in term of carbon (HULIS-C) were measured by a total organic carbon analyzer, while mass absorption efficiency at 365 nm (MAE365) and absorption Ångström exponent (AAE) were estimated from light absorption of HULIS that was recorded by UV–visible spectrophotometry. The annual mean concentration of HULIS-C was around 3.4 ± 1.6 μg m−3, while the annual mean values of MAE365 and AAE were approximately 2.7 ± 0.7 m2 g−1C and 4.0 ± 0.2, respectively. Seasonal variations were significant for MAE365 but negligible for AAE at both sites. A direct comparison of MAE365 of HULIS in this study with the median MAE365 values from different sources in laboratory studies indicated that crop residues burning and/or wood burning were the primary sources of light-absorbing HULIS, as is also supported by the strong correlation between the light absorption coefficient at 365 nm (Abs365) and K+ (r > 0.85, p < 0.01) throughout the year. Furthermore, the good correlation between Abs365 and secondary organic carbon implied secondary sources also contributed to light-absorbing HULIS (e.g., nitrated aromatic compounds production), as evidenced by the good correlation between Abs365 and NO3− and NH4+. The contribution of primary and secondary sources to light-absorbing HULIS was quantified using a machine learning algorithm, which showed >65% contribution from primary sources during the cold season, but only 35% during the warm seasons. © 2023",,,,
PH dependence of brown-carbon optical properties in cloud water,"Light-Absorbing organic species present in aerosols, collectively called brown carbon (BrC), have important but highly uncertain effects on climate. Clouds likely represent a significant medium for secondary BrC production and for bleaching reactions, though the relative importance of the formation and loss processes in clouds is unknown at present. The acidity (or pH) of atmospheric particles and clouds affects the optical properties of BrC and bleaching rates. Given the wide variability of pH in the atmosphere (pH in particles and clouds ranges from-1 to 8), the optical properties of BrC and its bleaching behavior are expected to vary significantly, and the link between pH and BrC is yet another uncertainty in attempts to constrain its climate forcing effects. In this work, we characterize the pH dependence of BrC optical properties-including light absorption at 365 nm (Abs365), the mass absorption coefficient (MAC365), and the absorption Ångström exponent (AAE)-in bulk cloud water sampled from the summit of Whiteface Mountain, NY. In all samples (nCombining double low line17), Abs365 and MAC365 increased linearly with increasing pH, highlighting the importance of reporting pH in studies of BrC in aqueous media. There was strong variability in the sensitivity of Abs365 to pH, with normalized slopes that ranged from 5.1 % to 17.2 % per pH unit. The normalized slope decreased strongly with increasing cloud water [K+], suggesting that the non-biomass-burning BrC has optical properties that are more sensitive to pH than BrC associated with biomass burning. AAE also showed a distinct pH dependence as it was relatively flat between pH 1.5-5 and then decreased significantly above pH 5. The cloud water composition was used to inform thermodynamic predictions of aerosol pH upwind and/or downwind of Whiteface Mountain and the subsequent changes in BrC optical properties. Overall, these results show that, in addition to secondary BrC production, photobleaching, and the altitudinal distribution, the climate forcing of BrC is quite strongly affected by its pH-dependent absorption.  © Copyright: ",,,,
Quantitative assessment of the impact of biomass burning episodes on surface solar radiation using machine learning technology: A case study of a pollution event in Beijing,"As an important source of pollutants in Beijing, biomass burning (BB) aerosols emitted by BB have a strong absorption and scattering effect on surface solar radiation (SSR). However, the existence of meteorological factors has a powerful impact on the estimation of the BB aerosol radiation effect. In this paper, a deweathered technique based on machine learning is presented to quantitatively isolate the influence of weather conditions from the radiative effect of BB aerosols. Furthermore, the seasonal trend of SSR is constrained by removing the general seasonal changes by the detrending method. The BB event on October 7–11, 2014, in Beijing was used as a case to validate the effectiveness of the proposed method. Experimental results show that meteorological factors aggravate the influence of BB events on SSR. Specifically, during the BB event, meteorological factors led to an additional increase of 10.9% in diffuse radiation and an additional decrease of 17.5%, 13.1%, 181.3%, 9.7% and 86.9% in global radiation, net radiation, horizontal direct radiation, reflected radiation and vertical direct radiation, respectively. After isolating the impact of meteorological factors on SSR in the BB event, we found that the average effects of BB aerosols on global radiation, net radiation, diffuse radiation, horizontal direct solar radiation, reflected radiation and vertical direct solar radiation during the BB event were −35.6 Wm−2 (−3.1 MJm−2day−1), −14.1 Wm−2 (−1.2 MJm−2day−1), 20.7 Wm−2 (1.8 MJm−2day−1), −67.3 Wm−2 (−5.8 MJm−2day−1), −8.9 Wm−2 (−0.8MJm−2day−1), and −132.9 Wm−2 (−11.5 MJm−2day−1), respectively. In conclusion, the weather normalization and detrended methods in this study provide a new idea for the accurate estimation of the impact of aerosols on SSR. This provides a quantitative reference for further understanding the impacts of atmospheric pollution on SSR. © 2023",,,,
"Variation of Aerosol Optical Properties over Cluj-Napoca, Romania, Based on 10 Years of AERONET Data and MODIS MAIAC AOD Product","Aerosols play an important role in Earth’s climate system, and thus long-time ground- based measurements of aerosol optical properties are useful in understanding this role. Ten years of quality-assured measurements between 2010 and 2020 are used to investigate the aerosol climatology in the Cluj-Napoca area, in North-Western Romania. In this study, we analyze the aerosol optical depth (AOD), single scattering albedo (SSA) and angstrom exponent obtained by the CIMEL sun photometer, part of the aerosol robotic network (AERONET), to extract the seasonality of aerosols in the region and investigate the aerosol climatology of the area. Higher aerosol loads are found during July and August. The angstrom exponent has the lowest values in April and May, and the highest in August. The classification of aerosols using AERONET data is performed to separate dust, biomass burning, polluted urban, marine and continental-dominant aerosol mixtures. In addition, the study presents the validation efforts of the Multi-Angle Implementation of Atmospheric Correction (MAIAC) dataset against AERONET AOD over a 10-year period. © 2023 by the authors.",,,,
Chemical and dynamical identification of emission outflows during the HALO campaign EMeRGe in Europe and Asia,"The number of large urban agglomerations is steadily increasing worldwide. At a local scale, their emissions lead to air pollution, directly affecting people's health. On a global scale, their emissions lead to an increase of greenhouse gases, affecting climate. In this context, in 2017 and 2018, the airborne campaign EMeRGe (Effect of Megacities on the transport and transformation of pollutants on the Regional to Global scales) investigated emissions of European and Asian major population centres (MPCs) to improve the understanding and predictability of pollution outflows. Here, we present two methods to identify and characterise pollution outflows probed during EMeRGe. First, we use a set of volatile organic compounds (VOCs) as chemical tracers to characterise air masses by specific source signals, i.e. benzene from anthropogenic pollution of targeted regions, acetonitrile from biomass burning (BB, primarily during EMeRGe-Asia), and isoprene from fresh biogenic signals (primarily during EMeRGe-Europe. Second, we attribute probed air masses to source regions and estimate their individual contribution by constructing and applying a simple emission uptake scheme for the boundary layer which combines FLEXTRA back trajectories and EDGAR carbon monoxide (CO) emission rates (acronyms are provided in the Appendix). During EMeRGe-Europe, we identified anthropogenic pollution outflows from northern Italy, southern Great Britain, the Belgium-Netherlands-Ruhr (BNR) area and the Iberian Peninsula. Additionally, our uptake scheme indicates significant long-range transport of pollution from the USA and Canada. During EMeRGe-Asia, the pollution outflow is dominated by sources in China and Taiwan, but BB signals from Southeast Asia and India contribute as well. Outflows of pre-selected MPC targets are identified in less than 20g% of the sampling time, due to restrictions in flight planning and constraints of the measurement platform itself. Still, EMeRGe combines in a unique way near- and far-field measurements, which show signatures of local and distant sources, transport and conversion fingerprints, and complex air mass compositions. Our approach provides a valuable classification and characterisation of the EMeRGe dataset, e.g. for BB and anthropogenic influence of potential source regions and paves the way for a more comprehensive analysis and various model studies.  © Author(s) 2023. This work is distributed under the Creative Commons Attribution 4.0 License. All rights reserved. ",,,,
Using machine learning to quantify sources of light-absorbing water-soluble humic-like substances (HULISws) in Northeast China,"Water-soluble humic-like substances (HULISws) are a group of heterogeneous organic compounds in the atmosphere, greatly impacting climate change and human health. As the most significant biomass burning (BB) and fossil fuel burning polluted area in China, Northeast China Plain could generate more light absorbing HULISws to the atmosphere. In this work, daily fine particle (PM2.5) samples were collected in Changchun, located in Northeast China Plain, from October 17th to November 29th, 2016, to investigate the potential sources of optical properties of HULISws. Here, the whole sampling period was divided into three sub-periods using the density of fire spots and the timeline of the central heating: the non-heating (October 17th to October 24th), early heating (October 25th to November 13th), and normal heating (November 14th to November 29th) periods. The mean mass concentrations of HULISws were 4.2 ± 1.2, 8.6 ± 3.6, and 2.4 ± 1.3 μg m−3 during the non-heating, early heating, and normal heating periods, respectively. The positive matrix factorization (PMF) model results suggested that the contribution of primary BB, secondary BB, and fossil fuel burning emissions were 46%, 24%, and 19% during the non-heating period, 22%, 29%, and 17% during the early heating period, and 13%, 16%, and 50% during the normal heating period, respectively. Combining the PMF results with the random forest (RF) algorithm, the contribution of each source to the optical properties was quantified. Here, BB still dominated the optical properties of HULISws in Northeast China. During the study period, the primary BB and secondary BB contributed 25% and 34% in the light absorption coefficient (Abs), 22% and 33% in the mass absorption exponent (MAE), and 17% and 33% in the absorption Ångström exponent (AAE), respectively. Other sources like cooking and fossil combustion contributed 25% and 35% in Abs, 35% and 26% in MAE, and 16% and 33% in AAE, respectively. © 2022 Elsevier Ltd",,,,
Effects of COVID-19 lockdown measures on nitrogen dioxide and black carbon concentrations close to a major Italian motorway,"During the first half of 2020, the Italian government imposed several restrictions to limit the spread of the COVID-19 pandemic: at the beginning of March, a heavy lockdown regime was introduced leading to a drastic reduction of traffic and, consequently, traffic-related emissions. The aim of this study is to evaluate the effects of these restrictions on pollutant concentrations close to a stretch of the Italian A22 motorway lying in the Alpine Adige valley. In particular, the analysis focuses on measured concentrations of nitrogen dioxide (NO2) and black carbon (BC). Results show that, close to the motorway, NO2 concentrations dropped by around 45% during the lockdown period with respect to the same time period of the previous 3 years. The equivalent analysis for BC shows that the component related to biomass burning, mostly due to domestic heating, was not particularly affected by the restrictions, while the BC component related to fossil fuels, directly connected to traffic, plummeted by almost 60% with respect to the previous years. Since atmospheric concentrations of pollutants depend both on emissions and meteorological conditions, which can mask the variations in the emission regime, a random forest algorithm is also applied to the measured concentrations, in order to better evaluate the effects of the restrictions on emissions. This procedure allows for obtaining business-as-usual and meteorologically normalized time series of both NO2 and BC concentrations. The results derived from the random forest algorithm clearly confirm the drop in NO2 emissions at the beginning of the lockdown period, followed by a slow and partial recovery in the following months. They also confirm that, during the lockdown, emissions of the BC component due to biomass burning were not significantly affected, while those of the BC component related to fossil fuels underwent an abrupt drop. © 2023 The Authors. Meteorological Applications published by John Wiley & Sons Ltd on behalf of Royal Meteorological Society.",,,,
"Development of current and future high-resolution gridded emission inventory of anthropogenic air pollutants for urban air quality studies in Hanoi, Vietnam","A high-resolution (1 km × 1 km) emission inventory was developed for Hanoi for 2017 and 2018. The total annual emissions of PM2.5, BC, OC, NOx, SO2, NMVOC, NH3, CH4, and CO were 14.9, 1.6, 2.9, 56.7, 19.1, 109.2, 23.0, 37.9, and 472.7 Gg, respectively. Transportation, industry, and agriculture contributed 89.1%, 92.2%, and 81.3% to the total emissions of PM2.5, BC, and OC, respectively. Transportation contributed 72.4%, 52.1%, and 72.5% to the emissions of NOx, NMVOC, and CO, respectively. Industry contributed 64.9% to the emissions of SO2. Agriculture was a major source of NH3 and CH4, contributing 84.2% and 76.6%, respectively. Future emissions of select sectors were estimated for 2030. The emissions from transportation can increase in the range of 26.9% (CH4) to 245.8% (NH3), despite the consideration of the EURO 5 standard. For domestic cooking, transitioning from coal to liquefied petroleum gas can help reduce the emissions of most pollutants in the range of 10.4% (NH3) to 52.6% (OC), except NOx and NMVOC. The crop residue burning (CRB) ban could reduce emissions in the range of 0.27 Gg (SO2) to 138.4 Gg (CO) in 2030, respectively. The study can help policy-makers to develop strategies for air pollution mitigation in developing economies such as Hanoi. © 2022",,,,
